{
  "schema_version": "1.0",
  "skill": "agentic-markdown",
  "skill_path": "skills/agentic-markdown/SKILL.md",
  "skill_version_tested": "2.0.1",
  "updated_at": "2026-06-02",
  "latest_average": 9.5,
  "results": {
    "instruction_clarity": {
      "score": 9.5,
      "pass": true
    },
    "script_tool_success": {
      "score": 1.0,
      "pass": true
    },
    "output_completeness": {
      "score": 100,
      "pass": true
    },
    "mode_coverage": {
      "score": 1.0,
      "pass": true
    },
    "blocking_issues": {
      "score": 0,
      "pass": true
    },
    "brief_specific_leakage": {
      "score": 0,
      "pass": true
    }
  },
  "briefs": {
    "already-split-structure": {
      "status": "pass",
      "results": {
        "instruction_clarity": {
          "score": 10.0,
          "pass": true
        },
        "script_tool_success": {
          "score": 1.0,
          "pass": true
        },
        "output_completeness": {
          "score": 100,
          "pass": true
        },
        "mode_coverage": {
          "score": 1.0,
          "pass": true
        },
        "blocking_issues": {
          "score": 0,
          "pass": true
        },
        "brief_specific_leakage": {
          "score": 0,
          "pass": true
        }
      },
      "notes": "Strict v2 zero-edit validation passed. Frontmatter, Source descriptions, context tables, relative links, and acyclic tree all validated without reading draft.md as implicit context."
    },
    "contradictory-instructions": {
      "status": "pass",
      "results": {
        "script_tool_success": {
          "score": 1.0,
          "pass": true
        },
        "output_completeness": {
          "score": 100,
          "pass": true
        },
        "mode_coverage": {
          "score": 1.0,
          "pass": true
        },
        "blocking_issues": {
          "score": 0,
          "pass": true
        },
        "brief_specific_leakage": {
          "score": 0,
          "pass": true
        }
      },
      "notes": "Executor stopped at contradiction check, made no structural edits, left playbook.md unchanged, and asked for resolution between keeping Setup inline and extracting it."
    },
    "existing-child-targeted-update": {
      "status": "pass",
      "results": {
        "instruction_clarity": {
          "score": 9.3,
          "pass": true
        },
        "script_tool_success": {
          "score": 1.0,
          "pass": true
        },
        "output_completeness": {
          "score": 100,
          "pass": true
        },
        "mode_coverage": {
          "score": 1.0,
          "pass": true
        },
        "blocking_issues": {
          "score": 0,
          "pass": true
        },
        "brief_specific_leakage": {
          "score": 0,
          "pass": true
        }
      },
      "notes": "Targeted update passed after v2.0.1 clarified legacy multi-H1 normalization and short residual sections. Existing ops child was reused and renamed to weekly-operations.md; escalation-policies.md was extracted without duplicate truth."
    },
    "invalid-split-structure": {
      "status": "pass",
      "results": {
        "instruction_clarity": {
          "score": 9.1,
          "pass": true
        },
        "script_tool_success": {
          "score": 1.0,
          "pass": true
        },
        "output_completeness": {
          "score": 100,
          "pass": true
        },
        "mode_coverage": {
          "score": 1.0,
          "pass": true
        },
        "blocking_issues": {
          "score": 0,
          "pass": true
        },
        "brief_specific_leakage": {
          "score": 0,
          "pass": true
        }
      },
      "notes": "Strict v2 repair passed. Duplicate entrypoint resolved, missing frontmatter repaired, raw-path Source rejected, broken/cyclic links fixed, and malformed context tables converted to valid tables."
    },
    "inline-links-vs-context-links": {
      "status": "pass",
      "results": {
        "instruction_clarity": {
          "score": 9.5,
          "pass": true
        },
        "script_tool_success": {
          "score": 1.0,
          "pass": true
        },
        "output_completeness": {
          "score": 100,
          "pass": true
        },
        "mode_coverage": {
          "score": 1.0,
          "pass": true
        },
        "blocking_issues": {
          "score": 0,
          "pass": true
        },
        "brief_specific_leakage": {
          "score": 0,
          "pass": true
        }
      },
      "notes": "Context-link clarification passed without edits. Workflow stayed the only Source child, glossary stayed in Dependencies, response-patterns stayed in Related, and inline example and citation links stayed inline."
    },
    "large-file": {
      "status": "pass",
      "results": {
        "instruction_clarity": {
          "score": 9.8,
          "pass": true
        },
        "script_tool_success": {
          "score": 1.0,
          "pass": true
        },
        "output_completeness": {
          "score": 100,
          "pass": true
        },
        "mode_coverage": {
          "score": 1.0,
          "pass": true
        },
        "blocking_issues": {
          "score": 0,
          "pass": true
        },
        "brief_specific_leakage": {
          "score": 0,
          "pass": true
        }
      },
      "notes": "Strict v2 conversion passed. Large one-file guide became a frontmatter-backed explicit tree with markdown-link Source lines, preserved critical refund text, left draft-notes.md outside the graph, and validated nested Source links relative to the containing file."
    }
  }
}
